{
  "$schema": "https://json-schema.org/draft/2020-12/schema",
  "$id": "https://percepta.io/schemas/module-manifest/v1.json",
  "title": "PerceptaModuleManifest",
  "type": "object",
  "additionalProperties": false,
  "required": ["schemaVersion", "moduleKey", "name", "version", "pluginApiVersion",
               "category", "model", "input", "configSchemaRef", "eventTypes", "resources"],
  "properties": {
    "schemaVersion":   { "const": "1.0.0" },
    "moduleKey":       { "type": "string", "pattern": "^[a-z][a-z0-9-]{2,48}$" },
    "name":            { "type": "string" },
    "description":     { "type": "string" },
    "version":         { "type": "string", "pattern": "^\\d+\\.\\d+\\.\\d+$" },
    "pluginApiVersion":{ "type": "string", "pattern": "^\\d+\\.\\d+\\.\\d+$" },
    "category":        { "enum": ["security", "hr", "productivity", "logistics", "retail", "industry"] },
    "vendor":          { "type": "string" },
    "signature":       { "type": "string" },
    "model": {
      "type": "object", "additionalProperties": false,
      "required": ["backend", "artifactRef"],
      "properties": {
        "backend":     { "enum": ["yolo", "pytorch", "tensorflow", "onnx", "tensorrt"] },
        "artifactRef": { "type": "string" },
        "sha256":      { "type": "string" },
        "classes":     { "type": "array", "items": { "type": "string" } }
      }
    },
    "input": {
      "type": "object", "additionalProperties": false,
      "properties": {
        "requiresRoi":   { "type": "boolean", "default": false },
        "requiresZones": { "type": "boolean", "default": false },
        "requiresLines": { "type": "boolean", "default": false },
        "minFps":        { "type": "number", "default": 1 },
        "maxFps":        { "type": "number", "default": 15 },
        "colorSpace":    { "enum": ["bgr", "rgb", "gray"], "default": "bgr" }
      }
    },
    "configSchemaRef": { "type": "string" },
    "configSchemaVersion": { "type": "string", "pattern": "^\\d+\\.\\d+\\.\\d+$", "default": "1.0.0" },
    "eventTypes": {
      "type": "array", "minItems": 1,
      "items": {
        "type": "object", "additionalProperties": false,
        "required": ["type", "defaultSeverity"],
        "properties": {
          "type":            { "type": "string", "pattern": "^[a-z][a-z0-9_.]+$" },
          "defaultSeverity": { "enum": ["info", "low", "medium", "high", "critical"] },
          "eventClass":      { "enum": ["alert", "telemetry"], "default": "alert" }
        }
      }
    },
    "resources": {
      "type": "object", "additionalProperties": false,
      "required": ["gpu"],
      "properties": {
        "gpu":       { "type": "boolean" },
        "vramMb":    { "type": "integer" },
        "targetFps": { "type": "number" }
      }
    }
  }
}
