{
  "schemaVersion": "1.0.0",
  "moduleKey": "person-entry",
  "name": "Ingreso de personas",
  "description": "Reconoce a las personas dadas de alta cuando entran, registra a qué hora pasó cada una y avisa cuando entra alguien sin acceso. Incluye la pantalla de bienvenida que saluda a quien llega y le muestra su zona en el plano. Requiere consentimiento expreso registrado por persona. A quien no está dado de alta no se le guarda ningún dato biométrico.",
  "version": "1.0.0",
  "pluginApiVersion": "1.0.0",
  "category": "security",
  "vendor": "percepta-core",
  "model": {
    "backend": "onnx",
    "artifactRef": "buffalo_l",
    "classes": [
      "face"
    ]
  },
  "input": {
    "requiresZones": false,
    "minFps": 1,
    "maxFps": 5,
    "colorSpace": "bgr"
  },
  "configSchemaRef": "./config.schema.json",
  "configSchemaVersion": "1.0.0",
  "eventTypes": [
    {
      "type": "person.unknown",
      "defaultSeverity": "low",
      "eventClass": "alert"
    },
    {
      "type": "access.denied",
      "defaultSeverity": "high",
      "eventClass": "alert"
    }
  ],
  "resources": {
    "gpu": false,
    "vramMb": 0,
    "targetFps": 2
  }
}
